<?xml version="1.0" encoding="UTF-8"?>
<tns:MeterReading xmlns:tns="http://www.emeter.com/energyip/amiinterface" xmlns:xsi="http://www.w3.org/2001/XMLSchema-instance" xsi:schemaLocation="http://www.emeter.com/energyip/amiinterface tf-items-UniversalAMIInterfaceTypes.xsd ">
  <tns:ServiceDeliveryPoint>
    <tns:mRID>tns:mRID</tns:mRID>
    <tns:idType>tns:idType</tns:idType>
    <tns:pathName>tns:pathName</tns:pathName>
    <tns:serviceType>tns:serviceType</tns:serviceType>
    <tns:lifeSupport>true</tns:lifeSupport>
    <tns:readRoute xsi:type="tns:IdentifiedObject"/>
    <tns:readSequence>tns:readSequence</tns:readSequence>
    <tns:averageDailyUsage>0.0</tns:averageDailyUsage>
    <tns:locationCode>tns:locationCode</tns:locationCode>
    <tns:serviceDeliveryRemarks>tns:serviceDeliveryRemarks</tns:serviceDeliveryRemarks>
    <tns:latitude>0.0</tns:latitude>
    <tns:longitude>0.0</tns:longitude>
    <tns:locationAccuracy>tns:locationAccuracy</tns:locationAccuracy>
    <tns:locationAccuracyUnits>tns:locationAccuracyUnits</tns:locationAccuracyUnits>
  </tns:ServiceDeliveryPoint>
  <tns:Meter>
    <tns:mRID>tns:mRID</tns:mRID>
    <tns:idType>tns:idType</tns:idType>
    <tns:pathName>tns:pathName</tns:pathName>
    <tns:manufacturer>tns:manufacturer</tns:manufacturer>
    <tns:modelNumber>tns:modelNumber</tns:modelNumber>
    <tns:manufacturedDate>2001-12-31T12:00:00</tns:manufacturedDate>
    <tns:serialNumber>tns:serialNumber</tns:serialNumber>
    <tns:lotNumber>tns:lotNumber</tns:lotNumber>
    <tns:testDate>2001-12-31T12:00:00</tns:testDate>
    <tns:serviceType>tns:serviceType</tns:serviceType>
    <tns:electricMeter/>
    <tns:numDigits>0</tns:numDigits>
    <tns:typeMeter>tns:typeMeter</tns:typeMeter>
  </tns:Meter>
  <tns:ComFunction>
    <tns:mRID>tns:mRID</tns:mRID>
    <tns:idType>tns:idType</tns:idType>
    <tns:pathName>tns:pathName</tns:pathName>
    <tns:manufacturer>tns:manufacturer</tns:manufacturer>
    <tns:modelNumber>tns:modelNumber</tns:modelNumber>
    <tns:manufacturedDate>2001-12-31T12:00:00</tns:manufacturedDate>
    <tns:serialNumber>tns:serialNumber</tns:serialNumber>
    <tns:lotNumber>tns:lotNumber</tns:lotNumber>
    <tns:testDate>2001-12-31T12:00:00</tns:testDate>
    <tns:amrAddress>tns:amrAddress</tns:amrAddress>
    <tns:amrSystem>tns:amrSystem</tns:amrSystem>
  </tns:ComFunction>
  <tns:CustomerAccount>
    <tns:mRID>tns:mRID</tns:mRID>
    <tns:idType>tns:idType</tns:idType>
    <tns:pathName>tns:pathName</tns:pathName>
    <tns:billingCycle>tns:billingCycle</tns:billingCycle>
  </tns:CustomerAccount>
  <tns:Reading>
    <tns:startTime>2001-12-31T12:00:00</tns:startTime>
    <tns:endTime>2001-12-31T12:00:00</tns:endTime>
    <tns:intervalLength>0</tns:intervalLength>
    <tns:value>0.0</tns:value>
    <tns:demandPeakTime>2001-12-31T12:00:00</tns:demandPeakTime>
    <tns:measurementSource>tns:measurementSource</tns:measurementSource>
    <tns:flags>0</tns:flags>
    <tns:status>0</tns:status>
    <tns:collectionTime>2001-12-31T12:00:00</tns:collectionTime>
    <tns:readingTypeId>tns:readingTypeId</tns:readingTypeId>
  </tns:Reading>
  <tns:IntervalBlock>
    <tns:readingTypeId>tns:readingTypeId</tns:readingTypeId>
    <tns:ReadingType/>
    <tns:IReading xsi:type="tns:IReading"/>
  </tns:IntervalBlock>
  <tns:Event>
    <tns:category>tns:category</tns:category>
    <tns:name>tns:name</tns:name>
    <tns:timestamp>2001-12-31T12:00:00</tns:timestamp>
    <tns:description>tns:description</tns:description>
    <tns:argument>
      <tns:name>tns:name</tns:name>
      <tns:value>tns:value</tns:value>
    </tns:argument>
    <tns:source>tns:source</tns:source>
    <tns:collectionTime>2001-12-31T12:00:00</tns:collectionTime>
  </tns:Event>
</tns:MeterReading>
